{
  "CUSTOMER": "5547785214556987452",
  "PANEL_ID": "Node 01",
  "DEVICE_ID": "22-011",
  "DEVICE_TYPE": "Smoke Detector",
  "DEVICE_LOCATION": "2FL CONF. RM",
  "STATUS": 1,
  "SAFER_ID": {
    "version": "0.1.0",
    "unique_id": "223e4567-e89b-12d3-a456-426614174000"
  },
  "OPTIONAL": {
    "CONTACT_ID": {
      "version": "SIA DC-05-1999.09",
      "code": "1111181111220118"
    }
  }
}