{
  "CUSTOMER": "5547785214556987452",
  "PANEL_ID": "Node 01",
  "DEVICE_ID": "SV-014",
  "DEVICE_TYPE": "Valve Tamper Switch",
  "DEVICE_LOCATION": "RISER RM",
  "STATUS": 2,
  "SAFER_ID": {
    "version": "0.1.0",
    "unique_id": "623e4567-e89b-12d3-a456-426614174000"
  },
  "OPTIONAL": {
    "SYSTEM_CATEGORY": "Fire Alarm",
    "CONDITION": "Valve Partially Closed",
    "DATE": "2026-02-20",
    "TIME": "10:05"
  }
}